Name,Categories,Key Words,Vendors,Color,Crystal Structure,Physical Properties,Chemical Properties,Mechanical Properties,Electrical Properties,Thermal Properties,Optical Properties,Component Elements Properties,Descriptive Properties,Processing,URL
Momentive Performance Materials TC1050 Encapsulated Thermal Pyrolytic Graphite (TPG),"Carbon, Graphite","GE Advanced Ceramics has developed a family of thermal materials based upon its high conductivity thermal pyrolytic graphite (TPG) material.  TPG is a unique form of pyrolytic graphite manufactured by the decomposition of a hydrocarbon gas in a high vacuum furnace. Referred to as TC1050, these macrocomposite materials offer both high conductivity, low density, and low thermal expansion properties.  TC1050 consists of a TPG core encapsulated within a structural shell. The TPG provides a highly conductive path while the encapsulation material provides the structure (strength, stiffness, and coefficient of thermal expansion). Chemical isolation and electrical insulation of the aluminum from the graphite resistive element for PBN/G evaporators permit electrical resistance stability and consistency throughout their long life.  This guarantees absolute flash-to-flash temperature repeatability, total aluminum evaporation and thickness (Q-value) consistency of the deposited layer.  Encapsulant materials include 6061 aluminum, OFHC copper, and graphite/polymer composites., Information provided by Momentive Performance Materials, formerly GE Advanced Ceramics.",N/A,,,N/A,N/A,N/A,N/A,[{'': {'Momentive Performance Materials TC1050 Encapsulated Thermal Pyrolytic Graphite (TPG)\n      \n      \n      \n    ': None}}],N/A,N/A,N/A,,https://www.matweb.com/search/DataSheet.aspx?MatGUID=46c0ea34de7c4a2b913b4f97e801c4c6
"Momentive Performance Materials ""PG"" Pyrolytic Graphite","Carbon, Graphite","Pyrolytic Graphite (PG) is a unique form of graphite manufactured by decomposition of a hydrocarbon gas at very high temperature in a vacuum furnace.  The result is an ultra-pure product which is near theoretical density and extremely anisotropic.  This anisotropy results from the layered structure.  As an example, PG exhibits a thermal conductivity consistent with the best conductors in the ""AB"" plane and lower than alumina brick in the ""C"" direction.  Mechanical thermal, and electrical properties are generally far superior to conventional graphites.  Typical properties are listed below.  PG is Available as plate, free-standing shapes (crucibles, boats, tubes, etc.), and as an impermeable coating on graphite and other substrates., APPLICATIONS:, Sputtering Targets, Ion Beam Grids, Ion Implant Hardware, Liquid Phase Epitaxy Hardware, Crucibles for Ultra High Vacuum, Thermal Insulators, Rocket Nozzles, Heater Elements, Information provided by Momentive Performance Materials, formerly GE Advanced Ceramics.",N/A,,,"[{'Density': {'Metric': '2.18-2.22g/cc', 'English': '0.0788-0.0802lb/in³', 'Comments': None}}]",N/A,"[{'Tensile Strength, Ultimate': {'Metric': '80.0MPa', 'English': '11600psi', 'Comments': '""ab"" direction'}}]",N/A,"[{'CTE, linear': {'Metric': '0.500µm/m-°C@Temperature 20.0 °C', 'English': '0.278µin/in-°F@Temperature 68.0 °F', 'Comments': 'ab direction'}}]",N/A,N/A,N/A,,https://www.matweb.com/search/DataSheet.aspx?MatGUID=07d26ab4d0e349aea3a200f447e9d2e1
Momentive Performance Materials HOPG Graphite Monochromator,"Carbon, Graphite","Advanced Ceramics' graphite monochromators are highly oriented forms of high purity pyrolytic graphite which diffract x-rays and neutrons with greater efficiency than any other material.  In x-ray analysis, intensity is increased 3 to 5 times over that obtained with conventionally used crystals.  A singly-bent focusing monochromator using graphite yields 3 times the intensity of lithium fluoride at equivalent resolution.  GE Advanced Ceramics originally introduced, and still offers, graphite monochromators with the lowest mosaic spread (>= 0.4°) available., Information provided by Momentive Performance Materials, formerly GE Advanced Ceramics.",N/A,,,"[{'Density': {'Metric': '2.255-2.265g/cc', 'English': '0.08147-0.08183lb/in³', 'Comments': None}}]",N/A,N/A,"[{'Electrical Resistivity': {'Metric': '0.0000350-0.0000450ohm-cm', 'English': '0.0000350-0.0000450ohm-cm', 'Comments': 'parallel (002) direction'}}]","[{'CTE, linear': {'Metric': '-0.100µm/m-°C@Temperature 20.0 °C', 'English': '-0.0556µin/in-°F@Temperature 68.0 °F', 'Comments': 'Slightly negative in parallel (002) direction.'}}]",N/A,N/A,N/A,,https://www.matweb.com/search/DataSheet.aspx?MatGUID=9a2c080c0c4a45da8bb0aad00d2fa342
Momentive Performance Materials Q-Coat™ Flash Evaporator,"Carbon, Graphite, Ceramic, Nitride","Patented Q-COAT™  FLASH EVAPORATORS represent a new generation of technology for the flash metallization market.  They are constructed by coating a graphite (G) resistive element with a layer of ultra high purity BORALLOY® pyrolytic boron nitride (PBN) and are engineered to be the most electrically consistent and chemically stable aluminum evaporators available.  Since PBN maintains its high electrical resistivity and resistance to corrosive attack by aluminum, even at extreme temperature, the aluminum remains completely isolated from the control circuit and the resulting power curve is amazingly stable and repeatable.  These PBN/Graphite (PBN/G) evaporators are also designed to directly substitute for ceramic evaporators in existing equipment., Performance Features, Ultra Pure, No Outgassing, Repeatable Power Curve, Very Long Life (Thousands of Flashes), Direct Substitute for Ceramic Elements, Less Down Time, Reduces Rework, Cost Effective, More Consistent Al Quality & Thickness, Chemical isolation and electrical insulation of the aluminum from the graphite resistive element for PBN/G evaporators permit electrical resistance stability and consistency throughout their long life.  This guarantees absolute flash-to-flash temperature repeatability, total aluminum evaporation and thickness (Q-value) consistency of the deposited layer., Information provided by Momentive Performance Materials, formerly GE Advanced Ceramics.",N/A,,,N/A,N/A,N/A,N/A,N/A,N/A,N/A,N/A,,https://www.matweb.com/search/DataSheet.aspx?MatGUID=21a8dc6f34874805842031c0d153ee4e
MarkeTech Carbon Aerogel,"Carbon, Ceramic, Aerogel","Availability: Paper Sheets: 85 x 250 mm; Random Pieces 0.5-20 mm; Granules and Powder., Data provided by MarkeTech International.  MarkeTech International is no longer in business.",N/A,,,"[{'Density': {'Metric': '0.800-0.900g/cc', 'English': '0.0289-0.0325lb/in³', 'Comments': None}}]",N/A,"[{'Compressive Modulus': {'Metric': '3.00GPa', 'English': '435ksi', 'Comments': None}}]","[{'Electrical Resistivity': {'Metric': '0.0500ohm-cm', 'English': '0.0500ohm-cm', 'Comments': None}}]","[{'Thermal Conductivity': {'Metric': '0.0400W/m-K', 'English': '0.278BTU-in/hr-ft²-°F', 'Comments': None}}]",N/A,N/A,[{'ColorBlack': {'Descriptive Properties': None}}],,https://www.matweb.com/search/DataSheet.aspx?MatGUID=c53a217a8d2d47d2926cc9ae611e88f3
"Pyrolytic Graphite, Low Temperature Isotropic (LTI)","Carbon, Graphite","LTI carbon is deposited from a fluidized bed (from pyrolyzed hydrocarbons) onto a substrate at temperatures below 1500°C.  The properties, including density, vary depending on the deposition conditions.",N/A,,,"[{'Density': {'Metric': '1.30-2.00g/cc', 'English': '0.0470-0.0723lb/in³', 'Comments': None}}]",N/A,"[{'Tensile Strength, Ultimate': {'Metric': '200MPa', 'English': '29000psi', 'Comments': None}}]",N/A,N/A,N/A,N/A,N/A,,https://www.matweb.com/search/DataSheet.aspx?MatGUID=3900a590074b4d2aad7189f2e3ddbfba
Vitreous Carbon (Glassy Carbon),Carbon,"Vitreous carbon is formed by the pyrolysis of a carbon-based polymer, such as phenol-formaldehyde, cellulose, or acrylonitrile, under a slow heating scheme.   It is a polycrystalline structure with fine grains. The properties, including density, vary depending on the deposition conditions.",N/A,,,"[{'Density': {'Metric': '1.45-1.50g/cc', 'English': '0.0524-0.0542lb/in³', 'Comments': None}}]",N/A,"[{'Tensile Strength, Ultimate': {'Metric': '70.0-200MPa', 'English': '10200-29000psi', 'Comments': None}}]",N/A,N/A,N/A,N/A,N/A,,https://www.matweb.com/search/DataSheet.aspx?MatGUID=2f4d47d4e39d4091baa8625d4ed46cb1
